{
  "record_class": "CONSPICUOUSLY_SYNTHETIC_ADMINISTRATION",
  "contract_version": "natal-time-measurement-reliability-contract-v1",
  "synthetic_participant_id": "SYNTH-P-00000001",
  "synthetic_component_id": "SYNTH-CC-00000001",
  "protocol_version_id": "SYNTH-PROTOCOL-V1",
  "form_version_id": "SYNTH-FORM-V1",
  "language_version_id": "SYNTH-LANGUAGE-V1",
  "mode_version_id": "SYNTH-MODE-V1",
  "accommodation_version_id": "SYNTH-ACCOMMODATION-V1",
  "occasion_number": 1,
  "scheduled_window_id": "SYNTH-WINDOW-UNSELECTED",
  "administration_status": "COMPLETE",
  "prior_response_visibility": false,
  "prior_feedback_or_chart_exposure": "NONE_RECORDED",
  "interim_event_status": "UNSELECTED",
  "contamination_status": "CLEAN_SYNTHETIC",
  "missingness_class": "NOT_MISSING",
  "missingness_reason_provenance": "NOT_APPLICABLE",
  "denominator_provenance": "SYNTHETIC_PROTOCOL_EXPECTED",
  "response_bundle_digest": "sha256:0000000000000000000000000000000000000000000000000000000000000001"
}
